commit,mean_rank,frac_interpretability_tests_passed,status,model_name,description
baseline,22.71,0.4186,baseline,PyGAM,generalized additive model with 10 splines per feature and default settings
baseline,41.62,0.6744,baseline,DT_mini,small decision tree with up to 8 max_leaf_nodes
baseline,43.43,0.5349,baseline,DT_large,large decision tree with up to 20 max_leaf_nodes
baseline,35.88,0.7442,baseline,OLS,ordinary least squares linear regression
baseline,39.20,0.5349,baseline,LassoCV,Lasso linear model with cross-validation to select the regularization parameter
baseline,35.55,0.7674,baseline,RidgeCV,Ridge linear model with cross-validation to select the regularization parameter
baseline,25.51,0.2326,baseline,RF,"random forest with 50 tree estimators, each with max_depth of 5"
baseline,23.12,0.5349,baseline,GBM,"gradient boosting machine with 100 tree estimators, each with max_depth of 3"
baseline,46.72,0.1628,baseline,MLP,"multi-layer perceptron with default hidden layer size, ReLU activation, and Adam solver"
baseline,38.14,0.3953,baseline,FIGS_mini,small FIGS with up to 8 max_rules
baseline,37.88,0.5814,baseline,FIGS_large,large FIGS with up to 20 max_rules
baseline,31.31,0.2791,baseline,RuleFit,RuleFit with up to 20 max_rules
baseline,40.60,0.7674,baseline,HSTree_mini,small HSTree with up to 8 max_leaf_nodes
baseline,35.85,0.6744,baseline,HSTree_large,large HSTree with up to 20 max_leaf_nodes
baseline,15.60,0.4651,baseline,EBM,explainable boosting machine (InterpretML) with 3 outer bags and 1000 max rounds
baseline,10.80,0.0698,baseline,TabPFN,TabPFN foundation model for tabular data
7a25e23,40.22,0.6047,,DecisionTreeSimple,Baseline interpretable regressor (shallow decision tree)
c41efc5,16.60,0.3953,discard,SparseHingeGAM,"Per-feature linear + hinge basis at quantile knots, LassoCV selects sparse piecewise-linear shape per feature"
1c2531b,20.46,0.4419,discard,TopKHingeGAM20,"LassoCV over per-feature linear+hinge basis (4 knots), then post-hoc keep top-20 coefficients for a compact formula"
189ac3b,18.89,0.4186,discard,LinearPlus3Hinges,RidgeCV linear model plus up to 3 greedily-selected hinge corrections; mostly linear formula with a few explicit non-linear bumps
d2b3330,19.89,0.4651,discard,RidgeHinges3_v2,RidgeCV linear part + 3 greedy hinges; equation-style output (bakes mean-shift + hinge-at-zero into intercept so point predictions work)
5d1165e,20.85,0.5116,discard,SparsePoly2,"LassoCV on [x, x^2] features per dimension; outputs a single-line polynomial equation in original units"
0bfc0ce,39.60,0.7674,discard,TopFeaturesOLS10,"LassoCV-selected top-10 features, refit via OLS; compact linear equation trying to retain high interp while improving rank"
c4f3815,32.95,0.7674,discard,AdaptiveSparseRidge15,"LassoCV picks feature set (cap 15), RidgeCV refit; compact linear equation, adaptive size"
c924db2,37.75,0.6977,discard,ContribRidge90,"RidgeCV on all features to rank by |coef * std|, keep features up to 90% cumulative contribution (cap 15), refit Ridge on subset"
e6b600a,35.62,0.6279,discard,TopFeaturesPoly2_5,"Top-5 features via LassoCV, each with linear + quadratic term, Ridge refit; compact polynomial per-feature formula"
6537951,29.92,0.5581,discard,AllRidgePlus1Quad,RidgeCV on all features + single quadratic term for the top feature; RidgeCV-style output with one extra row
ca1a50e,43.02,0.7674,keep,TopFeaturesOLS5,"LassoCV-selected top-5 features, refit via OLS; ultra-compact linear equation to reduce LLM arithmetic load (rerun in clean pool)"
860c5a7,41.88,0.7674,keep,TopFeaturesOLS8,"LassoCV-selected top-8 features, refit via OLS; slightly richer than OLS5 to trade off formula length vs rank"
476f08d,38.14,0.7674,keep,TopFeaturesOLS12,"LassoCV-selected top-12 features, refit via OLS"
380ea4d,38.65,0.7674,keep,TopFeaturesOLS20,"LassoCV-selected top-20 features, refit via OLS"
ef6a8e7,34.85,0.7209,discard,SparseRidge20,"LassoCV-selected top-20 features, refit with RidgeCV (mild L2 helps vs raw OLS when many features are correlated)"
3ee7fcf,30.46,0.7674,keep,LassoOLS_all,OLS refit on the full set of non-zero LassoCV features (no hard cap); adaptively sparse per dataset
7ef3dd2,24.86,0.6512,discard,ElasticNetOLS,"ElasticNetCV for feature selection (handles correlated features better than pure Lasso), refit via OLS"
7e060e4,34.29,0.7442,discard,MutualInfoOLS,"Mutual-information feature ranking (captures non-linear dependencies Lasso misses), keep features above 5% of max MI (cap 20), OLS refit for a compact linear equation"
0ec40c4,45.68,0.6744,discard,LassoHuber,LassoCV selects non-zero features; Huber regression refit (robust to outliers) on the selected subset; outputs the same compact linear equation as OLS-based variants
355dd73,34.52,0.7209,discard,LassoBayesRidge,LassoCV selects non-zero features; BayesianRidge refit on the selected subset (evidence-maximized shrinkage vs RidgeCV's grid); same compact linear equation
b6a2e44,36.55,0.7907,keep,ThresholdOLS,"OLS on all features, drop those whose |coef*std(x)| contribution is <2% of the top feature's, OLS refit on the retained subset"
d070464,37.78,0.7907,keep,ThresholdOLS_1pct,"OLS on all features, drop those whose |coef*std(x)| contribution is <1% of the top feature's, OLS refit on the retained subset (gentler threshold than 2pct)"
1231f3d,36.18,0.7209,discard,ThresholdOLS_5pct,"OLS on all features, drop those whose |coef*std(x)| contribution is <5% of the top feature's, OLS refit on the retained subset (stronger sparsity)"
31859a9,36.51,0.6977,discard,ThresholdOLS_0p5pct,"OLS on all features, drop those whose |coef*std(x)| contribution is <0.5% of the top feature's, OLS refit on the retained subset (very light pruning)"
d771bbe,28.23,0.6977,discard,IterThreshOLS_1pct,Iteratively fit OLS and prune features with |coef*std(x)| <1% of current top (up to 5 rounds); lets the threshold boundary re-settle as collinear features are removed
4e4d878,36.92,0.7209,discard,ThresholdRidge_1pct,"OLS on all features to rank by |coef*std(x)|, drop features below 1% of top contribution, RidgeCV refit on retained subset (L2 stabilizes coefs for mildly correlated features)"
8105d7f,25.69,0.6744,discard,ForwardStepOLS,"Forward-stepwise feature selection: greedily add features by R^2 gain, stop when gain<0.1% or 15 features, OLS refit"
00558bb,29.63,0.6977,discard,LassoLarsBIC_OLS,"LassoLarsIC with BIC criterion (no CV needed) for feature selection, OLS refit on non-zero set; typically sparser than LassoCV"
c24f321,24.72,0.7442,keep,LassoLarsAIC_OLS,"LassoLarsIC with AIC criterion (less aggressive than BIC, keeps more features) for feature selection, OLS refit on non-zero set"
e0ecb03,27.40,0.6512,discard,LassoLarsAIC_Thresh_OLS,"LassoLarsIC(AIC) selects features, then threshold-prune (drop |coef*std|<1% of top), OLS refit. Combines AIC's rank strength with threshold pruning's interp boost"
6040ab0,51.63,0.4884,discard,QuantileBinOLS,"Per-feature tercile binning: bin(x) = -1 (low), 0 (mid), +1 (high); OLS on the binned features with threshold pruning"
f6be9e9,38.92,0.6977,discard,LassoLarsAIC_Rounded3,LassoLarsIC(AIC) + OLS refit with coefficients rounded to 3 decimal places; simpler printed equation may help LLM interpretability tests
c3ea96d,29.54,0.7442,discard,LassoLarsAIC_Top10,"LassoLarsIC(AIC) for selection, capped at top-10 features by |coef|, OLS refit; compact formula via AIC + hard cap"
cca4d9b,32.89,0.6977,discard,LassoLarsAIC_Ridge,"LassoLarsIC(AIC) for feature selection, RidgeCV refit on selected subset for L2-stabilized coefs"
8f5f922,37.66,0.7907,keep,ThresholdOLS_1p5pct,"OLS on all features, drop those whose |coef*std(x)| contribution is <1.5% of top, OLS refit (between 1pct and 2pct thresholds)"
c0c61dc,nan,0.0000,crash,Lars10_OLS,"LARS selects top-10 features by correlation path, OLS refit on them"
4be6288,34.49,0.6744,discard,SignificanceOLS_t2,OLS on all features; drop features with |t-statistic| < 2; OLS refit on significant subset
6e92d90,26.51,0.6977,discard,AdaptiveLassoOLS,"Two-stage adaptive Lasso (Ridge-weighted penalty 1/|beta_ridge|) for feature selection, OLS refit on non-zero subset"
6f68b6a,35.35,0.6744,discard,BaggedOLS30,Average coefficients from 30 bootstrap OLS fits (bagged OLS) for lower-variance linear model; intercept recalibrated on full data
ddcbfee,32.57,0.6744,discard,OMP_OLS10,"Orthogonal Matching Pursuit selects 10 features greedily by max correlation with residual, OLS refit"
15d15a6,36.62,0.7209,discard,LassoLarsAIC_Top5,"LassoLarsIC(AIC) for selection, hard cap top-5 features by |coef|, OLS refit on compact subset"
b6e878f,38.09,0.6977,discard,ThresholdOLS_3pct,"OLS on all features, drop those with |coef*std(x)| contribution <3% of top, OLS refit (between 2pct and 5pct)"
61ded0f,35.94,0.6744,discard,PearsonCorr_OLS10,"Top-10 features by |Pearson correlation with y|, OLS refit on selected subset"
2afb8cf,33.11,0.7209,discard,SignificanceOLS_t1,OLS on all features; drop features with |t-statistic| < 1 (gentle); OLS refit
e2d61a5,34.34,0.5814,discard,WinsorThreshOLS_1p5,"Winsorize X at 1st/99th percentile per feature, then ThresholdOLS at 1.5% contribution threshold; aims to limit outlier leverage"
1708530,36.62,0.6744,discard,StabilitySel_OLS,"Stability selection: count LassoCV selection frequency across 20 bootstrap subsamples, keep features with frequency >=60%, OLS refit"
39e2388,27.08,0.6047,discard,LassoLarsAIC_Thresh_2pct,"LassoLarsIC(AIC) selects features, threshold-prune (drop |coef*std|<2% of top), OLS refit on final subset"
078c6d0,29.31,0.7442,discard,LassoLarsAIC_Top15,"LassoLarsIC(AIC) for selection, hard cap top-15 features by |coef|, OLS refit on compact subset"
75780ef,31.71,0.6744,discard,HuberThreshOLS_1p5,"Huber regression (robust to y-outliers) ranks features by |coef*std|, keep those >=1.5% of top, OLS refit for final equation"
